{
  "id": "shared.av.blocks-install",
  "tool": "shared",
  "title": "装到一半文件凭空消失 / 被杀毒软件删了，或提示这不是有效的应用程序",
  "symptoms": [
    "安装进行到一半突然失败，重试还是失败",
    "刚下好的 exe 双击提示不是有效的 Win32 应用程序",
    "装好的命令过一会儿就不见了",
    "杀毒软件弹过窗但被自己点掉了，没在意"
  ],
  "errors": [
    "不是有效的 Win32 应用程序",
    "is not a valid Win32 application",
    "拒绝访问",
    "Access is denied",
    "ENOENT: no such file or directory"
  ],
  "platforms": [
    "windows"
  ],
  "severity": "blocker",
  "cause": "两个独立机制常被混为一谈：① **杀软误报**——AI 工具装机脚本会下载二进制、改 PATH、写注册表，行为特征和恶意软件重合，Defender/360/火绒可能直接把文件删进隔离区。删除发生在安装过程中，于是报错落在下一步，看起来像「安装脚本有 bug」。② **文件本身下坏了**——从 U 盘拷贝或慢网下载被截断，exe 少了几十 KB，Windows 加载时报「不是有效的应用程序」。这两个的排查方式完全不同：一个查隔离区，一个比对文件大小/哈希。",
  "fix": {
    "steps": [
      {
        "desc": "先查隔离区——这是最快的一刀。打开 Windows 安全中心 → 病毒和威胁防护 → 保护历史记录，看有没有刚被隔离的文件。360/火绒同理看各自的隔离区。",
        "risk": "read-only"
      },
      {
        "desc": "找到了就点「还原」，并把安装目录加进白名单/信任区，再重装一次。",
        "risk": "low",
        "rollback": "在杀软里把该白名单条目删掉即可。"
      },
      {
        "desc": "隔离区是空的 → 走第二条线：比对文件完整性。对着下载好的 exe 算哈希，和官方公布的比。",
        "cmd": "certutil -hashfile \"文件路径.exe\" SHA256",
        "shell": "cmd",
        "risk": "read-only"
      },
      {
        "desc": "对不上就是下坏了/拷坏了——重新下载，别用「继续传输」，删掉重下。U 盘拷贝出问题的概率比想象中高，尤其是杂牌盘。",
        "risk": "low",
        "rollback": "无需回滚。"
      },
      {
        "desc": "⚠️ 别为了装个工具直接关掉实时防护就不管了。要临时关，装完立刻打开。",
        "risk": "read-only"
      }
    ],
    "verify": "重新安装能走完全程；装完的文件过十分钟还在（没被再次隔离）；命令能正常运行。",
    "auto": false
  },
  "evidence": "field",
  "verified_on": {
    "date": "2026-08-01",
    "os": "Windows 10 / 11",
    "note": "两种机制我们都在客户机上实际遇到过：Defender 误报（Cloxer/Wacatac 家族）以及 U 盘拷贝导致 exe 截断。"
  },
  "sources": [],
  "uking": "U-King 装机时会先做一次环境预检，能提前报出杀软拦截和文件不完整两类问题。",
  "tags": [
    "杀毒软件",
    "误报",
    "文件损坏",
    "装不上"
  ]
}
